11,Burmese,The Burmese is a medium-size cat of 8 to 12 pounds,10 to 16 years,/assets/images/burmese1.jpeg,/assets/images/burmese2.jpeg,/assets/images/burmese3.jpeg,"<p>The ancestors of the Burmese are the Siamese and the copper cat of Burma (now known as Myanmar). It’s thought that they were temple and palace cats bred and kept by priests. The matriarch of the modern Burmese was a small, dark-brown cat named Wong Mau. She belonged to Dr. Joseph Thompson, who either acquired her from a sailor or brought her back himself from his travels, depending on which story you believe.</p><br><p>Wong Mau was at first thought to be a Siamese with a chocolate-colored coat. Such Siamese weren’t unheard of. Chocolate Siamese were described in the 1880s. Their bodies were tan or brown, and they had seal-brown or nearly black points. The seal-point Siamese, also known as royal Siamese, had lighter bodies that contrasted with their dark points and were preferred by breeders and the public. The chocolate-colored cats eventually disappeared in Britain, but they still existed in Thailand and Burma (now known as Myanmar), where they were probably the offspring of natural (as opposed to human-directed) matings between free-roaming Siamese (pointed) and solid-colored Burmese cats. Wong Mau was one of them. It was her destiny to become the matriarch of two new breeds: the Burmese and, later, the Tonkinese. </p><br><p>Dr. Thompson bred Wong Mau to a seal-point Siamese named Tai Mau. His breeding program, in conjunction with breeders Virginia Cobb and Billie Gerst and geneticist Clyde Keeler, produced kittens with beige, brown and pointed coats. The results, including the discovery of the Burmese gene, were so interesting that Thompson published an article on the subject in a 1943 issue of the Journal of Heredity, the first such piece on feline genetics. </p><br><p>The Cat Fanciers Association began registering Burmese in 1936 but suspended registrations in 1947 because breeders were still using Siamese in their breeding programs. Registrations resumed in 1953 after the practice was stopped. Today the Burmese is a popular breed among cat lovers.</p>","<p>The Burmese is energetic and friendly. He has the charm and determination of his Siamese ancestors, and enjoys conversation as much as that breed, but his voice is soft and sweet, belying his tendency to run the household with an iron paw sheathed in velvety fur. He is highly intelligent and seeks out human companionship, so he’s not best suited to a home where he will be left alone much of the day. If no humans will be around to engage his intellect, be sure he has the company of another pet. He gets along well with other cats and with dogs, but of course another Burmese will be his best pal. </p><br><p>The Burmese is about as curious as cats come. Expect him to explore your home thoroughly and know all of its nooks and crannies. He is playful and remains so into adulthood. Tease his clever mind with interactive toys, and teach him tricks that will allow him to show off for an audience. Besides sit, roll over, wave and come, he can learn to fetch a small toy or walk on a leash. With proper early conditioning, car rides and vet visits will be a breeze. </p><br><p>A Burmese is a good choice if you don’t object to complete loss of privacy. This cat will want to be involved in everything you do, from reading the newspaper and working at the computer to preparing meals and watching television. He will, of course, sleep on the bed with you and may even snuggle under the covers. When you are sitting down, he will be in your lap or right next to you, waiting expectantly to be petted. You will be scolded if you ignore him. Guests will receive his full attention, and it is likely that he will win over even those who claim to dislike cats. </p><br><p>A female Burmese is the very definition of queenliness. She likes attention and she likes to be in charge. Males are more restful, satisfied to fill a lap. Whichever you choose, it’s likely that you will soon find yourself yearning for another.</p>","<p>The soft, short coat of the Burmese is easily cared for with weekly brushing or combing to remove dead hair and distribute skin oil. A bath is rarely necessary. Brush the teeth to prevent periodontal disease. Daily dental hygiene is best, but weekly brushing is better than nothing. Wipe the corners of the eyes with a soft, damp cloth to remove any discharge. Use a separate area of the cloth for each eye so you don’t run the risk of spreading any infection. Check the ears weekly. If they look dirty, wipe them out with a cotton ball or soft damp cloth moistened with a 50-50 mixture of cider vinegar and warm water. Avoid using cotton swabs, which can damage the interior of the ear. </p><br><p>Keep the litter box spotlessly clean. Like all cats, Burmese are very particular about bathroom hygiene. It’s a good idea to keep a Burmese as an indoor-only cat to protect him from diseases spread by other cats, attacks by dogs or coyotes, and the other dangers that face cats who go outdoors, such as being hit by a car. Burmese who go outdoors also run the risk of being stolen by someone who would like to have such a beautiful cat without paying for it.</p>","<p>The active and social Burmese is a perfect choice for families with children and cat-friendly dogs. He will play fetch as well as any retriever, learns tricks easily and loves the attention he receives from children who treat him politely and with respect. He lives peacefully with cats and dogs who respect his authority. Always introduce pets slowly and in controlled circumstances to ensure that they learn to get along together.</p>","<p>Both pedigreed cats and mixed-breed cats have varying incidences of health problems that may be genetic in nature. Burmese are generally healthy, although they can be prone to gingivitis and may be sensitive to anesthesia. The following diseases have also been seen in Burmese: 1) Lipemia of the aqueous humor, a transient milky appearance of the eye during kittenhood, which usually resolves on its own. 2) Corneal dermoid, the presence of skin and hair on the surface of the cornea, which can be successfully corrected surgically. 3) Burmese head defect, a craniofacial abnormality.</p>"
12,Burmilla,The Burmilla is a medium-size cat of 7 to 14 pounds,10 to 15 years,/assets/images/burmilla1.jpeg,/assets/images/burmilla2.jpeg,/assets/images/burmilla3.jpeg,"<p>The Burmilla is another example of the accidental creation of a new cat breed. The unplanned mating between a Burmese and a chinchilla Persian in England in 1981 produced four black shaded female kittens with short, thick coats. The breeder realized how attractive such a breed could be and went on to develop what became known as the Burmilla.</p><br><p>The Burmilla is recognized by Britain’s Governing Council of the Cat Fancy and Europe’s Federation Internationale Feline. The breed entered the Cat Fanciers Association Miscellaneous Class in February 2011.</p>","<p>The Burmilla brings together aspects of the Burmese and the Persian into one sweet, friendly package. He is quietly affectionate and gentle but more extroverted than the typical Persian. He is adventurous but a bit of a klutz, so put away breakables when he is around.</p><br><p>Burmillas remain playful into adulthood. They love their people, but they aren’t excessively demanding of attention. When a lap is available, though, the Burmilla is there.</p>","<p>The Burmilla’s short, smooth coat is simple to groom with weekly brushing or combing to remove dead hairs. A bath is rarely necessary. Brush or comb a longhaired Burmilla two or three times a week. Brush the teeth to prevent periodontal disease. Daily dental hygiene is best, but weekly brushing is better than nothing. Trim the nails weekly. Wipe the corners of the eyes with a soft, damp cloth to remove any discharge. Use a separate area of the cloth for each eye so you don’t run the risk of spreading any infection. </p><br><p>Check the ears weekly. If they look dirty, wipe them out with a cotton ball or soft damp cloth moistened with a 50-50 mixture of cider vinegar and warm water. Avoid using cotton swabs, which can damage the interior of the ear. Keep the litter box spotlessly clean. Cats are very particular about bathroom hygiene. </p><br><p>It’s a good idea to keep a Burmilla as an indoor-only cat to protect him from diseases spread by other cats, attacks by dogs or coyotes, and the other dangers that face cats who go outdoors, such as being hit by a car. Burmillas who go outdoors also run the risk of being stolen by someone who would like to have such a beautiful cat without paying for it.</p>","<p>The gentle and playful Burmilla is well suited to life with families with children and cat-friendly dogs. He can learn tricks, enjoys interactive toys, and loves the attention he receives from children who treat him politely and with respect. Supervise young children and show them how to pet the cat nicely. Instead of holding or carrying the cat, have them sit on the floor and pet him. Always introduce any pets, even other cats, slowly and in a controlled setting.</p>","<p>Burmilla are generally healthy.</p>"
13,Chartreux,The Chartreux typically weighs between 7 and 16 pounds.,11 to 15 years,/assets/images/chartreux1.jpeg,/assets/images/chartreux2.jpeg,/assets/images/chartreux3.jpeg,"<p>With his cloak of gray fur, sober as a monk’s robes,  it’s no wonder that the Chartreux was associated with the Carthusian order in France. The quiet mousers would have been perfect companions for members of the silent, solitary order. It’s a pretty legend, but there is no real evidence that the cats were kept by the Carthusians, although perhaps they were simply not considered important enough to mention. A more likely scenario is that the cats, a natural breed, were commonly found in France at least as far back as the 18th century, performing rat patrol in stables, shops and homes. Unfortunately for the beautifully furred felines, they were also prized by furriers for their thick blue pelts. A type of luxurious wool called pile de Chartreux may have taken its name from the soft, woolly coated cats. As with so many breeds, however, it’s not really known how the cats came by their name or how or where they were developed. One of the earliest references to a French gray cat dates to 1558, an epitaph for Belaud, who belonged to poet Joachin de Bellay. Bellay describes Belaud death to rats, which is certainly an attribute of the breed, then and now. The first reference to the name Chartreux for the blue cats is found in the Universal Dictionary of Commerce, Natural History and the Arts and Trade of Savvary of Brusion, published in 1723, which also mentions the cats’ association with the fur trade. French naturalist George-Louis Leclerc, Comte de Buffon, described them as the cat of France and gave them the Latin name Felis catus coeruleus, meaning blue cat. Free-living groups of the cats lived in Paris and other areas of France until the early 1900s. They were not much valued, except for their skins and their aptitude for vermin control. It wasn’t until after World War I that French cat lovers took steps to preserve the breed. They gathered as many cats as they could and wrote a breed standard. Using only the cats that met the standard and produced kittens that met it, they were able to begin exhibiting the cats in European shows in either 1928 or 1931, depending on the source. One of the breed’s early adherents was the novelist Colette, whose Chartreux Saha took pride of place in her book La Chatte. General Charles de Gaulle was also known to love the breed, owning one named Gris Gris. It was fortunate that fanciers had begun to breed the Chartreux when they did, because after World War II, none of the free-roaming cats could be found. Chartreux, which are still uncommon, were first imported into the United States in 1970 and were recognized by the Cat Fanciers Association in 1987. Today the cats are recognized by all major American cat associations. The Chartreux is even the official mascot of the Montreux Jazz Festival.</p>","<p>The Chartreux might well be compared to a mime, silent but communicative and sometimes silly. Short playtimes interspersed with naps and meals are his idea of the perfect day. When he is not displaying his superb timing and pouncing ability, killing toys with abandon, or performing acrobatic flips as he chases a lure toy, he is an attentive and gentle companion who likes to stay near his people and observe their doings. He appreciates any attention he receives, especially if it involves scratching him beneath the chin or between the ears, but he’s not demanding, content to follow you around devotedly, sleep on your bed and snuggle with you if you’re not feeling well. He rarely uses his voice, preferring to direct your actions with a glance from his pumpkin-colored eyes. If need be, however, he may communicate with a  small meow or chirp. Make a habit of observing him carefully and being familiar with his actions since it is unlikely that he will vocalize any discomfort or make any sound to let you know where he is. This is an adaptable cat with a middle-of-the-road personality. He’s not a social butterfly, but he’s not a shy wallflower, either. Expect him to watch and wait before deciding whether to greet a guest or otherwise involve himself in a situation. His calm nature makes him suited to staying home alone while you are out earning the money for his treats and toys, but he won’t object to keeping company with another cat or dog. That same good nature makes him a good travel companion for an RV enthusiast or long-distance truck driver. As long as you keep his routine similar each day, he will be a happy camper. The Chartreux has a sunny, polite disposition that makes him a pleasure to live with. This is one cat who  does his best to obey the rules. Always treat him kindly and patiently, and you will be rewarded with a friend for life.</p>","<p>The Chartreux’s short, thick coat is easy to care for with weekly brushing. The coat sheds in the spring and may require extra brushing during that time. A bath is rarely necessary. If your Chartreux does require a bath, remember that it can take time to get the water-repellent coat wet enough for bathing. Brush the teeth to prevent periodontal disease. Daily dental hygiene is best, but weekly brushing is better than nothing. Trim the nails every couple of weeks. Wipe the corners of the eyes with a soft, damp cloth to remove any discharge. Use a separate area of the cloth for each eye so you don’t run the risk of spreading any infection. Check the ears weekly. If they look dirty, wipe them out with a cotton ball or soft damp cloth moistened with a 50-50 mixture of cider vinegar and warm water. Avoid using cotton swabs, which can damage the interior of the ear. Keep the Chartreux’s litter box spotlessly clean. Cats are very particular about bathroom hygiene. It’s a good idea to keep a Chartreux as an indoor-only cat to protect him from diseases spread by other cats, attacks by dogs or coyotes, and the other dangers that face cats who go outdoors, such as being hit by a car. Chartreux who go outdoors also run the risk of being stolen by someone who would like to have such a beautiful cat without paying for it.</p>","<p>The tolerant and gentle Chartreux fits nicely in a home with children. He is more likely to walk away than to scratch if he doesn’t like the way he is being handled. Parents with young children should always supervise interactions to make sure the cat isn’t mistreated. He is happy to live with cat-friendly dogs, too, thanks to his amiable disposition. Introduce pets slowly and in controlled circumstances to ensure that they learn to get along together. </p>","<p>Both pedigreed cats and mixed-breed cats have varying incidences of health problems that may be genetic in nature. Chartreux are generally healthy, but the following problems have been seen in the breed. Patellar luxation is a hereditary dislocation of the kneecap that can range from mild to severe. Mild patellar luxation rarely causes problems. Severe cases cause lameness, but can be alleviated with surgery.</p>"
14,Chinese Li Hua,The Chinese Li Hua typically weighs between 9 and 12 pounds.,9 to 16 years,/assets/images/chineseLiHua1.png,/assets/images/chineseLiHua2.png,/assets/images/chineseLiHua3.png,"<p>The unofficial cat of China, the Li Hua (pronounced lee-wah) is thought to be one of the earliest known domestic cats. Based on their mention in old books, they have probably existed throughout China for centuries, but it is only recently that they have been developed as a breed. This is a natural breed, meaning it was not developed through crosses of other breeds. The Chinese Li Hua was accepted into the Cat Fanciers Association’s Miscellaneous Class in February 2010.The Chinese Li Hua cat is also known as China Li Hua, Dragon Li, Li Hua, Lu Hua Mao, Li Hua Mau, and Li Mao.</p>","<p>Smart, loyal and lively, the Li Hua is gentle with people but has a reputation as a talented hunter of rats and other vermin. His retrieval skills extend beyond rodents. One Li Hua is said to have learned to fetch the morning paper.</p>","<p>The Chinese Li Hua’s short, smooth coat is simple to groom with weekly brushing or combing to remove dead hairs. A bath is rarely necessary.</p><br><p>Brush the teeth to prevent periodontal disease. Daily dental hygiene is best, but weekly brushing is better than nothing. Trim the nails weekly. Wipe the corners of the eyes with a soft, damp cloth to remove any discharge. Use a separate area of the cloth for each eye so you don’t run the risk of spreading any infection. </p><br><p>Check the ears weekly. If they look dirty, wipe them out with a cotton ball or soft damp cloth moistened with a 50-50 mixture of cider vinegar and warm water. Avoid using cotton swabs, which can damage the interior of the ear. </p><br><p>Keep the litter box spotlessly clean. Cats are very particular about bathroom hygiene. It’s a good idea to keep a Chinese Li Hua as an indoor-only cat to protect him from diseases spread by other cats, attacks by dogs or coyotes, and the other dangers that face cats who go outdoors, such as being hit by a car. Li Hua who go outdoors also run the risk of being stolen by someone who would like to have such a rare cat without paying for it.</p>","<p>This active but mild-mannered cat is well suited to life with families with children and cat-friendly dogs. He can learn tricks, enjoys interactive toys, and loves the attention he receives from children who treat him politely and with respect. Supervise young children and show them how to pet the cat nicely. Instead of holding or carrying the cat, have them sit on the floor and pet him. Always introduce any pets, even other cats, slowly and in a controlled setting.</p>","<p>Chinese Li Hua are generally healthy.</p>"
15,Colorpoint Shorthair,Colorpoints are medium-size cats that typically weigh 5 to 10 pounds,12 to 17 years,/assets/images/colorpointShorthair1.jpeg,/assets/images/colorpointShorthair2.jpeg,/assets/images/colorpointShorthair3.jpg,"<p>The Colorpoint Shorthair is a Siamese of a different color—non-traditional colors, that is.  The breed was developed using Siamese as the foundation and then crossing it with a red American Shorthair to bring in a new color. That was successful and attractive, and the cats became the basis for a new breed: the Colorpoint Shorthair.  Eventually, other non-traditional colors were created. The breed was recognized by the Cat Fanciers Association in 1964. The International Cat Association considers the Colorpoint a variety of Siamese, not a separate breed.</p>","<p>The Siamese and the Colorpoint Shorthair might differ in color, but beneath the skin they are identical. The Colorpoint Shorthair is talkative and opinionated. He will tell you exactly what he thinks, in a loud, raspy voice, and he expects you to pay attention and act on his advice. Colorpoints are extremely fond of their people. They like to be helpful and will follow you around and supervise your every move. When you are sitting down, a Colorpoint Shorthair will be in your lap, and at night he will be in bed with you, probably under the covers with his head on the pillow.</p><br><p>Do not get a Colorpoint if living with a chatty busybody would drive you insane. On the other hand, if you enjoy having someone to talk to throughout the day, a Colorpoint can be your best friend. Just be sure you have time to spend with this demanding and social cat. Colorpoints do not like being left alone for long periods, and if you work during the day it can be smart to get two of them so they can keep each other company. </p><br><p>The Colorpoint is highly intelligent, agile and athletic, and loves to play. Keep his busy brain active with puzzle toys and his body exercised with teaser toys that he can chase and a big cat tree he can climb. He is fully capable of opening doors and drawers or rifling through your purse in search of something interesting or shiny to play with. Never leave him without any form of entertainment, or you will likely come home to find that he has reprogrammed your DVR to record only nature shows or at the very least decided that your toilet paper rolls and tissue boxes look better empty. </p><br><p>Choose a Colorpoint if you look forward to spending time with and interacting with your cat. This is a loyal and loving feline who will pout and pine if given little or no attention. In the right home, however, he thrives for years.</p>","<p>The short, fine coat of the Colorpoint is easily cared for. Comb it every couple of weeks with a stainless steel comb or soft bristle brush to remove dead hair, then polish it with a soft cloth to make it shine. </p><br><p>Brush the teeth to prevent periodontal disease. Daily dental hygiene is best, but weekly brushing is better than nothing. Wipe the corners of the eyes with a soft, damp cloth to remove any discharge. Use a separate area of the cloth for each eye so you don’t run the risk of spreading any infection. Check the ears weekly. If they look dirty, wipe them out with a cotton ball or soft damp cloth moistened with a 50-50 mixture of cider vinegar and warm water. Avoid using cotton swabs, which can damage the interior of the ear. </p><br><p>Keep the Colorpoint’s litter box spotlessly clean. Cats are very particular about bathroom hygiene. It’s a good idea to keep a Colorpoint as an indoor-only cat to protect him from diseases spread by other cats, attacks by dogs or coyotes, and the other dangers that face cats who go outdoors, such as being hit by a car. Colorpoints who go outdoors also run the risk of being stolen by someone who would like to have such a beautiful cat without paying for it.</p>","<p>The active and social Colorpoint is a perfect choice for families with children and cat-friendly dogs. He will play fetch as well as any retriever, learns tricks easily and loves the attention he receives from children who treat him politely and with respect. He gets along with cats and dogs who respect his authority. Always introduce pets slowly and in controlled circumstances to ensure that they learn to get along together.</p>","<p>Both pedigreed cats and mixed-breed cats have varying incidences of health problems that may be genetic in nature. The same problems that may affect the Siamese can also affect the Colorpoint Shorthair, including the following: 1) Asthma/bronchial disease, 2) Congenital heart defects such as aortic stenosis, 3) Nystagmus, a neurological disorder that causes involuntary rapid eye movement.</p>"
