16,Cornish Rex,The Cornish Rex typically weighs 6 to 10 pounds.,11 to 15 years,/assets/images/cornishRex1.jpg,/assets/images/cornishRex2.jpg,/assets/images/cornishRex3.jpg,"<p>Cornwall is a sort of magical corner of Great Britain. It was the birthplace of King Arthur, and it was the birthplace of one of the most unusual and interesting cat breeds in existence: the curly-coated Cornish Rex. A curly-coated kitten was born in 1950 to a shorthaired tortoiseshell and white pet cat named Serena, who belonged to Nina Ennismore and Winifred Macalister. The other four kittens in the litter had short hair, so Kallibunker, as he was named, stood out for his odd coat, the result of a spontaneous natural mutation. As is so often the case, the father of the litter was unidentified, although he was suspected to be Ginger, a shorthaired red tabby who was Serena’s litter brother.</p><br><p>After obtaining advice on how to establish the new trait, Ennismore attempted to produce more of the kittens, breeding them to each other and outcrossing to shorthaired cats. She was somewhat successful, breeding among others a cat named Poldhu and his daughter LaMorna Cove, both of whom contributed to the later development of the breed, which came to be called the Cornish Rex, after its birthplace and its coat type, similar in texture to that of rex rabbits. </p><br><p>LaMorna Cove had been exported to the United States, and her kittens—from a breeding with Poldhu before she made her journey across the pond—helped to establish the breed in the United States. Because of the lack of breeding stock, the cats in the U. S. were outcrossed to Siamese. A son of Poldhu, Sham Pain Chas, fathered a litter in Great Britain in 1960, keeping the breed alive in its homeland. Also contributing to its survival was the birth of two curly-coated kittens in East Germany, who were determined to have a similar mutation that was compatible with that of the Cornish Rex. </p><br><p>The American Cat Fanciers Association and the Canadian Cat Association recognized the Cornish Rex in 1963, followed by the Cat Fanciers Association in 1964. The breed is now recognized by all cat registries.</p>","<p>The Cornish Rex appears suave and refined, but then this charming and highly intelligent cat’s sense of humor and love of attention take over and he strolls onto center stage, ready to play the piano, perform tricks, or amaze onlookers with his ability to vault to the highest point in the room. His long toes enable him to manipulate objects deftly and to open doors and cabinets with ease. Be sure you put away securely anything you don’t want him to have (and don’t let him see you doing it). </p><br><p>This is a confident cat who loves people and will follow them around, waiting for any opportunity to sit in a lap or give a kiss. He enjoys being handled, making it easy to take him to the veterinarian or train him for therapy work. </p><br><p>If it weren’t insulting, it might be fair to describe the Cornish Rex as doglike. That includes his willingness to retrieve toys that are thrown. He has the speed of a sighthound but does not share the sighthound’s laidback temperament. The Cornish Rex is highly active, always on the move. His speed and sleek exterior are reminiscent of a finely tuned racecar, complete with quick starts and cornering ability. Although he is affectionate and gentle, he is not the choice for someone who wants a quiet, ornamental cat. His voice ranges from sweet to strident, and although he is not as talkative as his ancestor the Siamese, he will indeed carry on a conversation if he feels the need to express his opinion. </p><br><p>The Cornish Rex maintains his kittenlike attitude well into old age. He never loses the desire to interact with people and is best suited to a home where he will receive the love and constant companionship he craves.</p>","<p>Grooming the Cornish Rex is typically as easy as brushing your hand over his coat. Some Cornish Rex cats have a longer or woollier coat, however, and may need some help from a soft bristle brush or fine-tooth comb to keep their coat looking neat. Groom gently so you don’t break the delicate hairs. The best thing about a Cornish Rex coat is that the hairs are so fine that they aren’t very noticeable on clothing and furniture. </p><br><p>Baths are rarely necessary unless the cat is white or has a lot of white on the coat. Those cats can start to look dingy if they are not regularly bathed. </p><br><p>Brush the teeth to prevent periodontal disease. Daily dental hygiene is best, but weekly brushing is better than nothing. Wipe the corners of the eyes daily with a soft, damp cloth to remove any discharge. Use a separate area of the cloth for each eye so you don’t run the risk of spreading any infection. Check the ears weekly. If they look dirty, wipe them out with a cotton ball or soft damp cloth moistened with a 50-50 mixture of cider vinegar and warm water. Avoid using cotton swabs, which can damage the interior of the ear. </p><br><p>Keep the litter box spotlessly clean. Like all cats, Cornish Rex are very particular about bathroom hygiene. </p><br><p>The Cornish Rex feels warm to the touch, but he is always seeking warmth. If you are cold, he probably is too. Buy him a nice sweater or two to help him retain heat. </p><br><p>It’s a good idea to keep a Cornish Rex as an indoor-only cat to protect him from diseases spread by other cats, attacks by dogs or coyotes, and the other dangers that face cats who go outdoors, such as being hit by a car. Cornish Rex who go outdoors also run the risk of being stolen by someone who would like to have such an unusual cat without paying for it. If possible, build your Cornish Rex a large outdoor enclosure where he can jump and climb safely. If your Cornish REx has an outdoor enclosure that allows for sunbathing, be sure to apply cat-safe sunscreen to his body to prevent sunburn.</p>","<p>The active and social Cornish Rex is a perfect choice for families with children and cat-friendly dogs. He will play fetch as well as any retriever, learns tricks easily and loves the attention he receives from children who treat him politely and with respect. Introduce pets slowly and in controlled circumstances to ensure that they learn to get along together.</p>","<p>Both pedigreed cats and mixed-breed cats have varying incidences of health problems that may be genetic in nature. Cornish Rex are generally healthy, but the following diseases have been seen in the breed: 1) Congenital hypotrichosis, otherwise known as hereditary baldness, a condition that is probably the result of an inherited recessive gene. The Cornish Rex naturally has a very fine coat, but those with less hair than normal for the breed are considered to be hypotricotic. 2) Umbilical hernia, which occurs when a defect in the abdominal wall—near the umbilicus, hence the name—allows part of the intestine or other abdominal organs to protrude through the abdominal wall. The last known report of umbilical hernias in the breed was from 1997. Umbilical hernias can also have non-genetic causes. 3) Hypertrophic cardiomyopathy, a form of heart disease that is inherited in some cat breeds such as the Maine Coon. Heritability has not been proven in the Cornish Rex.</p>"
17,Cymric,This is a medium-size cat who weighs 8 to 12 pounds and feels surprisingly heavy when lifted.,8 to 14 years,/assets/images/cymric1.jpeg,/assets/images/cymric2.png,/assets/images/cymric3.jpeg,"<p>Is it really a cat if it doesn’t have a tail? It is if it’s a Cymric (pronounced kim-rick). There are lots of cats with short tails or no tails, but the Cymric (and his sister breed the shorthaired Manx) is the only one specifically bred to be tail-free. Sometimes jokingly said to be the offspring of a cat and a rabbit (however cute the idea, a cabbit is biologically impossible), these particular tailless cats are the result of a natural genetic mutation that was then intensified by their remote location on the Isle of Man, off the coast of Britain.</p><br><p>The cats are thought to date to 1750 or later, but whether a tailless cat was born there or arrived on a ship and then spread its genes throughout the island cat population is unknown. The island became known for tailless cats, and that is how the breed got its name of Manx. The Manx has long been recognized by the Cat Fanciers Association, The International Cat Association, and other cat registries. A longhaired version was accepted by CFA as a division of the Manx in 1994. In some associations, the longhaired Manx is called a Cymric and is considered a separate breed.</p>","<p>These cats originated as mousers, and whether shorthaired or longhaired they retain their fine hunting skills and alert nature. With a Cymric around the house, you don’t need a watchdog; you’ve got a watchcat who reacts rapidly and will growl threateningly or maybe even go on the attack at the sight or sound of anything out of the ordinary. If he sees that you aren’t alarmed, he’ll settle back down. </p><br><p>When he’s not protecting his family and property from mice, stray dogs, or other threats, however, the Cymric is a mellow fellow: an even-tempered and affectionate cat who enjoys serene surroundings. That’s not to say he is inactive. This is a happy, playful cat who likes to follow his favorite person through the house and assist with whatever he or she is doing. When you are ready to relax, though, the Cymric will be in your lap, ready for a comfy nap. If no lap is available, he’ll curl up on the nearest available spot that allows him to keep an eye on you. He speaks in a quiet trill and will carry on a conversation if you talk to him. </p><br><p>The Cymric has an adaptable nature if he is exposed to activity and plenty of people as a young kitten. He will enjoy meeting new people, greeting them with a gentle head butt or cheek rub, and can adapt to a new home or family if such an upheaval in his life is necessary. </p><br><p>This is a smart cat who can learn tricks, including fetch and come, and is willing to walk on leash if taught early. He often likes to ride in the car, making him a great companion on long-distance trips. He is also good at learning how to open doors, so be sure anything you don’t want him to have is under lock and key. Unlike most cats, the Cymric is willing to accept boundaries and will usually respect your wishes if you tell him no when he jumps on the counter or scratches on your sofa. Just be sure you give him an acceptable alternative as thanks for his nice behavior. </p><br><p>The Cymric is highly people-oriented. Choose him only if you can give him plenty of time and attention daily.</p>","<p>The Cymric’s coat is easily cared for with brushing or combing a couple of times a week to remove dead hair and distribute skin oil.  Check the rear end closely to make sure feces aren’t clinging to the fur surrounding the anus, and clean it if necessary to prevent the cat from smearing poop on carpets or furniture. </p><br><p>Brush the teeth to prevent periodontal disease. Daily dental hygiene is best, but weekly brushing is better than nothing. Wipe the corners of the eyes with a soft, damp cloth to remove any discharge. Use a separate area of the cloth for each eye so you don’t run the risk of spreading any infection. Check the ears weekly. If they look dirty, wipe them out with a cotton ball or soft damp cloth moistened with a 50-50 mixture of cider vinegar and warm water. Avoid using cotton swabs, which can damage the interior of the ear. </p><br><p>Keep the litter box spotlessly clean. Like all cats, Cymrics are very particular about bathroom hygiene. </p><br><p>It’s a good idea to keep a Cymric as an indoor-only cat to protect him from diseases spread by other cats, attacks by dogs or coyotes, and the other dangers that face cats who go outdoors, such as being hit by a car. Cymrics who go outdoors also run the risk of being stolen by someone who would like to have such a beautiful cat without paying for it.</p>","<p>If he is introduced to them in kittenhood, the active and social Cymric is a perfect choice for families with children and cat-friendly dogs. He will play fetch as well as any retriever, learns tricks easily and loves the attention he receives from children who treat him politely and with respect. He lives peacefully with cats and dogs who respect his authority and can learn to leave birds and fish alone. An adult Cymric may not appreciate children as readily, especially if he is used to a quiet household. Always introduce pets slowly and in controlled circumstances to ensure that they learn to get along together.</p>","<p>Both pedigreed cats and mixed-breed cats have varying incidences of health problems that may be genetic in nature. Cymric are generally healthy, but the following diseases have been seen in the breed: 1) Arthritis of the tailbone in cats with partial tails. 2) Corneal dystrophy, cloudiness that begins to develop when a kitten is approximately 4 months old.</p>"
18,Devon Rex,The Devon Rex weigh 5 to 10 pounds.,9 to 15 years,/assets/images/devonRex1.jpeg,/assets/images/devonRex2.jpeg,/assets/images/devonRex3.jpeg,"<p>It was first thought that Kirlee, a kitten born in Devon, England, in 1959, shared the same genetic makeup as the Cornish Rex, a breed born a decade earlier in nearby Cornwall, but test breedings soon established that Kirlee was unique, another result of a natural genetic mutation. As suggested by his name, Kirlee had a wavy coat. Little is known of his ancestry. His mother was a stray, and his father was thought to be a roaming tom who also had a curly coat.</p><br><p>Kirlee became the progenitor of a new breed, the Devon Rex, named for his birthplace of Devonshire, as well as his curly coat, which had a texture reminiscent of that of a rex rabbit. Less than a decade later, in 1968, a Devon Rex had emigrated to the United States. The Cat Fanciers Association gave the breed full recognition in 1979.</p>","<p>The Devon’s favorite perch is right at head level, on the shoulder of his favorite person. He takes a lively interest in everything that is going on and refuses to be left out of any activity. Count on him to stay as close to you as possible, occasionally communicating his opinions in a quiet voice. He loves people and welcomes the attentions of friends and family alike. </p><br><p>This is a smart cat with a moderate activity level. He’s not in constant motion, but he does like to learn tricks and play fetch. Puzzle toys and interactive toys are a delight to his inventive brain and will help to keep him occupied while you are out earning money to buy more of them. </p><br><p>At mealtime, the Devon will try to seat himself at the dining room table with the rest of the family, sure that the food you have prepared is just for him. He likes to eat and will snack himself into a few extra pounds if you don’t carefully monitor his food intake. </p><br><p>Under the covers is his preferred place to sleep. Like a heat-seeking missile, he targets the warmest spots he can find. </p><br><p>Choose a Devon if you will enjoy the company of a mischievous, agile cat and won’t be alarmed to see him peering down at you from the top of a door, plotting the trajectory to your shoulder.</p>","<p>The Devon’s wavy coat is easy to maintain. Groom gently so you don’t break the delicate hairs. In many cases, brushing your hand over the coat is all it needs. The best thing about a Devon Rex coat is that it doesn’t shed much, and the fur is so fine that it isn’t very noticeable on clothing and furniture. </p><br><p>Baths are rarely necessary unless the cat is white or has a lot of white on the coat. Those cats can start to look dingy if they are not regularly bathed. The coat dries quickly after a bath. </p><br><p>Brush the teeth to prevent periodontal disease. Daily dental hygiene is best, but weekly brushing is better than nothing. Wipe the corners of the eyes daily with a soft, damp cloth to remove any discharge. Use a separate area of the cloth for each eye so you don’t run the risk of spreading any infection. Check the ears weekly. If they look dirty, wipe them out with a cotton ball or soft damp cloth moistened with a 50-50 mixture of cider vinegar and warm water. Avoid using cotton swabs, which can damage the interior of the ear. </p><br><p>Keep the litter box spotlessly clean. Like all cats, Devon Rex are very particular about bathroom hygiene. </p><br><p>The Devon Rex feels warm to the touch, but he is always seeking warmth. If you are cold, he probably is too. Buy him a nice sweater or two to help him retain heat. </p><br><p>It’s a good idea to keep a Devon Rex as an indoor-only cat to protect him from diseases spread by other cats, attacks by dogs or coyotes, and the other dangers that face cats who go outdoors, such as being hit by a car. Devon Rex who go outdoors also run the risk of being stolen by someone who would like to have such an unusual cat without paying for it. If possible, build your Devon Rex a large outdoor enclosure where he can jump and climb safely. If your Devon Rex has an outdoor enclosure that allows for sunbathing, be sure to apply cat-safe sunscreen to his body to prevent sunburn.</p>","<p>The active and social Devon Rex is a perfect choice for families with children and cat-friendly dogs. He will play fetch as well as any retriever, learns tricks easily and loves the attention he receives from children who treat him politely and with respect. Introduce pets slowly and in controlled circumstances to ensure that they learn to get along together.</p>","<p>Both pedigreed cats and mixed-breed cats have varying incidences of health problems that may be genetic in nature. Devon Rex are generally healthy, but the following diseases have been seen in the breed: 1) Congenital hypotrichosis, otherwise known as hereditary baldness, a condition that is probably the result of an inherited recessive gene. The Devon Rex naturally has a very fine coat, but those with less hair than normal for the breed are considered to be hypotricotic. 2) Urticaria pigmentosa, a dermatological problem that causes crusty sores on the body and is treated with prednisolone and essential fatty acids.</p>"
19,Egyptian Mau,The Mau is a medium-size cat of 6 to 14 pounds,10 to 15 years,/assets/images/egyptianMau1.jpeg,/assets/images/egyptianMau2.jpeg,/assets/images/egyptianMau3.jpeg,"<p>Whether the Mau is a product of thousands of years of Egyptian culture is a matter of debate, but if fanciers of the strikingly spotted cats wish to claim that they date to the times of the pharaohs, well, who knows? It could be true.</p><br><p>The Egyptian Mau (mau being the Egyptian word for cat) is notable for being the only naturally spotted domesticated cat. In other words, the spotting pattern was not created by human manipulation of feline genes. The cats were known in Europe before World War II, but the devastation of the war left the breed in a perilous state. </p><br><p>The breed as it is known today dates to a silver female kitten given to Russian princess Natalie Troubetskoy when she was living in Rome. Depending on the story, the kitten was given to her by a young boy who had been keeping it in a shoebox or she acquired one from the Egyptian ambassador to Italy. Troubetskoy named the kitten Baba. When she moved to the United States in 1956, Baba and two of her offspring came with her. Troubetskoy wanted to ensure that the Mau survived as a breed, so she wrote a breed standard and began breeding the cats under the cattery name Fatima. </p><br><p>The breed was recognized in 1968 by the Cat Fanciers Federation, followed in 1977 by the Cat Fanciers’ Association. Importation of more Maus in the 1980s and again in 1991 increased the breed’s gene pool. Today the breed is recognized by most cat associations.</p>","<p>When the Egyptian Mau is happy, you know it. He vocalizes (called chortling) in a quiet, pleasant voice, swishes his tail rapidly, and kneads with his front paws. What makes him happy is being with his family, to whom he is fiercely devoted, or showing off his hunting prowess by chasing and retrieving a tossed toy or stalking and pouncing on a wriggling lure at the end of a fishing pole toy. </p><br><p>This is a moderately to highly active cat. He likes to jump and climb and will appreciate a tall cat tree, a window perch or two, and a sturdy scratching post that allows him to stretch out to full height. The Mau also enjoys playing in water. Don’t be surprised to find him dipping a paw into your koi pond or aquarium, turning on the tap in the bathroom or kitchen, or splashing water out of your pool — or his water dish. </p><br><p>The Egyptian Mau prefers family members to anyone else. When he’s not playing fetch, he enjoys sitting  in a lap and being worshipped, just as his ancestors may have been. </p><br><p>The Mau has the distinction of being the fastest domestic housecat, as she can run at speeds of up to 30 mph.</p>","<p>The Egyptian Mau’s coat is easily cared for with weekly combing to remove dead hair and distribute skin oils. A bath is rarely necessary. </p><br><p>Brush the teeth to prevent periodontal disease. Daily dental hygiene is best, but weekly brushing is better than nothing. Trim the nails every couple of weeks. Wipe the corners of the eyes with a soft, damp cloth to remove any discharge. Use a separate area of the cloth for each eye so you don’t run the risk of spreading any infection. Check the ears weekly. If they look dirty, wipe them out with a cotton ball or soft damp cloth moistened with a 50-50 mixture of cider vinegar and warm water. Avoid using cotton swabs, which can damage the interior of the ear. </p><br><p>Keep the litter box spotlessly clean. Cats are very particular about bathroom hygiene, and a dirty box may cause them to start using other places in the house instead. </p><br><p>It’s a good idea to keep an Egyptian Mau as an indoor-only cat to protect him from diseases spread by other cats, attacks by dogs or coyotes, and the other dangers that face cats who go outdoors, such as being hit by a car. Keeping him indoors also protects local birds and wildlife from this avid hunter. Egyptian Maus who go outdoors also run the risk of being stolen by someone who would like to have such a beautiful cat without paying for it.</p>","<p>The active and playful Mau is a perfect choice for families with children and cat-friendly dogs. He will play fetch as well as any retriever, learns tricks easily and loves the attention he receives from children who treat him politely and with respect. He’s smart enough to get out of the way of toddlers but loves school-age children because they are a match for his energy level and curiosity. Nothing scares him, certainly not dogs, and he will happily make friends with them if they don’t give him any trouble. He is a skilled hunter, however, and pet birds or other small animals are probably not safe in his presence. Always introduce any pets, even other cats, slowly and in a controlled setting.</p>","<p>Both pedigreed cats and mixed-breed cats have varying incidences of health problems that may be genetic in nature. Egyptian Maus are generally healthy, but be sure to ask a breeder about the incidence of health problems in her lines and what testing has been done for any that are genetic in nature.</p>"
20,European Burmese,"This is a medium-size cat that usually weighs six to 10 pounds, sometimes more.",10 to 15 years,/assets/images/europeanBurmese1.png,/assets/images/europeanBurmese2.png,/assets/images/europeanBurmese3.png,,,,
21,Exotic,This is a medium-size cat. Exotics usually have a weight range of 7 to 12 pounds.,8 to 15 years,/assets/images/exotic1.jpeg,/assets/images/exotic2.jpeg,/assets/images/exotic3.jpeg,,,,
22,Havana Brown,The Havana is a medium-size cat weighing 6 to 10 pounds.,10 to 15 years,/assets/images/havanaBrown1.png,/assets/images/havanaBrown2.png,/assets/images/havanaBrown3.png,,,,
23,Himalayan,This is a medium-size cat. Himalayans usually have a weight range of 7 to 12 pounds.,9 to 15 years,/assets/images/himalayan1.jpeg,/assets/images/himalayan2.jpeg,/assets/images/himalayan3.jpeg,,,,
24,Javanese Bobtail,"The Javanese Bobtail is a medium-size cat, weighing 6 to 10 pounds.",9 to 15 years,/assets/images/japaneseBobtail1.jpeg,/assets/images/japaneseBobtail2.png,/assets/images/japaneseBobtail3.png,,,,
25,Javanese ,Javanese are medium-size cats that weigh 5 to 10 pounds,10 to 15 years,/assets/images/javanese1.png,/assets/images/javanese2.png,/assets/images/javanese3.jpeg,,,,
26,Korat,"The Korat is a medium-size cat, weighing from 6 to 10 pounds.",10 to 15 years,/assets/images/korat1.jpeg,/assets/images/korat2.jpeg,/assets/images/korat3.jpeg,,,,
27,LaPerm,"The LaPerm is a small cat, weighing five to eight pounds. He reaches maturity when he is two to three years old.",10 to 15 years,/assets/images/laperm1.jpeg,/assets/images/laperm2.jpeg,/assets/images/laperm3.jpeg,,,,
28,Maine Coon,"This is a large cat. Most Maine Coons weigh 9 to 18 pounds (males are larger), and some tip the scales at 20 or more pounds. They don't reach their full size until they are three to five years old.",9 to 15 years,/assets/images/maineCoon1.jpeg,/assets/images/maineCoon2.jpeg,/assets/images/maineCoon3.jpeg,,,,
29,Manx,This is a medium-size cat who weighs 8 to 12 pounds and feels surprisingly heavy when lifted. The Manx matures slowly and may not reach his full size until he is five years old.,8 to 14 years,/assets/images/manx1.jpeg,/assets/images/manx2.jpeg,/assets/images/manx3.jpeg,,,,
30,Nebelung,This is a medium to large size cats weighing 7 to 15 pounds,11 to 16 years,/assets/images/nebelung1.jpeg,/assets/images/nebelung2.jpeg,/assets/images/nebelung3.jpeg,,,,
