6,Balinese,Balinese are medium-size cats that weigh 5 to 10 pounds.,9 to 15 years,/assets/images/balinese1.jpeg,/assets/images/balinese2.jpeg,/assets/images/balinese3.jpeg,"<p>Named for the exotically graceful dancers on the Indonesian island of Bali, the Balinese is a longhaired variety of Siamese.  It is unknown whether the long hair is the result of a natural mutation or a cross between the Siamese and a longhaired breed such as a Persian or Turkish Angora. Although longhaired Siamese appeared earlier, the cats did not begin to be developed as a breed until the 1940s and 1950s. The Cat Fanciers Federation recognized the Balinese in 1961, followed by the Cat Fanciers Association in 1970. They are also recognized by the American Cat Fanciers Association and The International Cat Association, as well as other cat registries. Balinese can be outcrossed to Javanese, Siamese, Colorpoint Shorthairs and Oriental Longhairs.</p>","<p>The Siamese and the Balinese might differ in coat length, but beneath the skin they are identical. Balinese are extremely fond of their people. They like to be helpful and will follow you around and supervise your every move. When you are sitting down, a Balinese will be in your lap, and at night he will be in bed with you, probably under the covers with his head on the pillow. He is frequently underfoot, so he might not be the best choice for people who are unsteady on their feet or use a walker or cane. A Balinese is perhaps not quite as loud as his relative the Siamese, but he is most definitely just as opinionated. He will tell you exactly what he thinks, and he expects you to pay attention and act on his advice. You can also count on him to tell all to visitors, so be grateful that most people are not conversant in the Balinese language.</p><br><p> The Balinese is highly intelligent, agile and athletic, and loves to play. Keep his busy brain active with puzzle toys and his body exercised with teaser toys that he can chase and a big cat tree he can climb. He likes to play fetch, is willing to walk on a leash, and learns tricks easily. He is also a good trainer himself and may be running your household before you know it. Never leave him without any form of entertainment, or you will likely come home to find that he has reprogrammed your DVR to record only nature shows or at the very least decided that your toilet paper rolls and tissue boxes look better empty. Do not get a Balinese if living with a chatty busybody would drive you insane. On the other hand, if you enjoy having someone to talk to throughout the day, the Balinese can be your best friend. Just be sure you have time to spend with this demanding and social cat. Balinese don’t mind staying home during the day while you go off to earn money to buy cat food, but they will expect you to devote time to them when you are at home. It can be smart to get two of them so they can keep each other company. Choose a Balinese if you look forward to spending time with and interacting with your cat. This is a loyal and loving feline who will pout and pine if given little or no attention. In the right home, however, he thrives for years.</p>","<p>The fine, silky coat of the Balinese is easily cared for. Comb it once or twice a week with a stainless steel comb to remove dead hair.  A bath is rarely necessary. Brush the teeth to prevent periodontal disease. Daily dental hygiene is best, but weekly brushing is better than nothing. Wipe the corners of the eyes with a soft, damp cloth to remove any discharge. Use a separate area of the cloth for each eye so you don’t run the risk of spreading any infection. Check the ears weekly. If they look dirty, wipe them out with a cotton ball or soft damp cloth moistened with a 50-50 mixture of cider vinegar and warm water. Avoid using cotton swabs, which can damage the interior of the ear. Keep the litter box spotlessly clean. Like all cats, Balinese are very particular about bathroom hygiene. It’s a good idea to keep a Balinese as an indoor-only cat to protect him from diseases spread by other cats, attacks by dogs or coyotes, and the other dangers that face cats who go outdoors, such as being hit by a car. Balinese who go outdoors also run the risk of being stolen by someone who would like to have such a beautiful cat without paying for it.</p>","<p>The active and social Balinese is a perfect choice for families with children and cat-friendly dogs. He will play fetch as well as any retriever, learns tricks easily and loves the attention he receives from children who treat him politely and with respect. He lives peacefully with cats and dogs who respect his authority. Always introduce pets slowly and in controlled circumstances to ensure that they learn to get along together.</p>","<p>Both pedigreed cats and mixed-breed cats have varying incidences of health problems that may be genetic in nature. The same problems that may affect the Siamese can also affect the Balinese, including the following: 1) Lymphoma, 2) crossed eyes, 3) megaesphagus.</p>"
7,Bengal ,Bengals are large cats and weigh 8 to 15 pounds or more.,10 to 16 years,/assets/images/bengal1.jpg,/assets/images/bengal2.jpeg,/assets/images/bengal3.jpg,"<p>With his distinctive spotted coat and large size, the Bengal looks like a wild cat on the prowl, but although one of his ancestors is the small, wild Asian leopard cat, he’s a domestic cat through and through. Bengals take their name from the Asian leopard cat’s scientific name, Felis bengalensis. They were created through crosses between an Asian leopard cat — which in the 1950s and into the 1960s could be purchased at pet stores — and domestic shorthairs. Jean Mill, a breeder in California, was the first to make such a cross, but not because she wanted to create a new breed. She had acquired a leopard cat and allowed her to keep company with a black tom cat so she wouldn’t be lonely. To her surprise, since she hadn’t thought the two species would mate, kittens resulted, and Mill kept a spotted female. Breeding her back to her father produced a litter of spotted and solid kittens.</p><br><p> At about the same time, Dr. Willard Centerwall was crossing Asian leopard cats with domestic cats at Loyola University. The leopard cats were resistant to the feline leukemia virus, so researchers were interested in finding out if the trait could be passed on to hybrid offspring. Various breeders became interested in developing the cats as a breed. Mill was one of them. Changes in her life had caused her to give up cat breeding, but she was ready to begin again. She had acquired some of Dr. Centerwall’s hybrids and sought out suitable males to breed to them. One was an orange domestic shorthair that she found in India, of all places, and the other was a brown spotted tabby acquired from a shelter.</p><br><p> Bengals today are considered to be one and the same with domestic cats, and any Bengal purchased should be at least four generations removed from any ancestors with wild bloodlines. The first cat association to recognize the Bengal was The International Cat Association, which granted the breed experimental status in 1983, followed by full recognition in 1991. The Bengal is also recognized by the American Cat Fanciers Association, the Canadian Cat Association and the United Feline Organization. Bengal cats are so sought after, that a British woman paid over $50,000 for her bengal cat in 1990, dubbing them the "Rolls Royce" of feline companions.</p>","<p>The Bengal is highly active and highly intelligent. This makes him fun to live with, but he can sometimes be challenging. On the whole, the Bengal is a confident, talkative, friendly cat who is always alert. Nothing escapes his notice. He likes to play games, including fetch, and he’s a whiz at learning tricks. His nimble paws are almost as good as hands, and it’s a good thing he doesn’t have opposable thumbs or he would probably rule the world. Bored bengal cats can also adopt some unconventional (and slightly destructive) habits, including: turning light switches on and off, fishing seals out of drains and excitedly plucking CDs from your DVD player.Fond of playing in water, the Bengal is not above jumping into the tub or strolling into the shower with you.</p><br><p> Aquarium and pond fish may be at risk from his clever paws. He also loves to climb and can often be found perching at the highest point he can reach in the home. A tall cat tree or two is a must for this feline, as are puzzle toys that will challenge his intelligence. On the rare occasions that he isn’t swinging on chandeliers or swimming in your pool, the affectionate Bengal will be pleased to sit on your lap. It goes without saying that he will share your bed. And yes, he steals the covers.</p>","<p>The short, thick coat of the Bengal is easily cared for with weekly combing to remove dead hair and distribute skin oils. A bath is rarely necessary. Brush the teeth to prevent periodontal disease. Daily dental hygiene is best, but weekly brushing is better than nothing. Trim the nails every couple of weeks. Wipe the corners of the eyes with a soft, damp cloth to remove any discharge. Use a separate area of the cloth for each eye so you don’t run the risk of spreading any infection. Check the ears weekly. If they look dirty, wipe them out with a cotton ball or soft damp cloth moistened with a 50-50 mixture of cider vinegar and warm water. Avoid using cotton swabs, which can damage the interior of the ear. Keep the litter box spotlessly clean.</p><br><p> Cats are very particular about bathroom hygiene, and a dirty box may cause them to start using other places in the house instead. It’s a good idea to keep a Bengal as an indoor-only cat to protect him from diseases spread by other cats, attacks by dogs or coyotes, and the other dangers that face cats who go outdoors, such as being hit by a car. Keeping him indoors also protects local birds and wildlife from this avid hunter. If possible, build your Bengal a large outdoor enclosure where he can jump and climb safely. Bengals who go outdoors also run the risk of being stolen by someone who would like to have such a beautiful cat without paying for it.</p>","<p>The active and social Bengal is a perfect choice for families with children and cat-friendly dogs. He will play fetch as well as any retriever, learns tricks easily and loves the attention he receives from children who treat him politely and with respect. He’s smart enough to get out of the way of toddlers but loves school-age children because they are a match for his energy level and curiosity. Nothing scares him, certainly not dogs, and he will happily make friends with them if they don’t give him any trouble. Always introduce any pets, even other cats, slowly and in a controlled setting. Like many active cats, bengals have a high prey drive and should not be trusted with smaller prey animals such as: hamsters, smaller rabbits and guinea pigs.</p>","<p>Both pedigreed cats and mixed-breed cats have varying incidences of health problems that may be genetic in nature. Bengals are generally healthy, but the following diseases have been seen in the breed. 1) Flat-chested kitten syndrome, a deformity that can range from mild to severe. Kittens who survive to adulthood usually show no signs once they reach maturity. 2) Hip dysplasia, which in severe cases can cause lameness</p>"
8,Birman,Birmans typically weigh 6 to 12 pounds,12 to 16 years,/assets/images/birman1.jpeg,/assets/images/birman2.jpeg,/assets/images/birman3.jpeg,"<p>A beautiful cat deserves a beautiful legend of origin. The Sacred Cat of Burma, as the Birman is sometimes called, is said to have acquired his striking appearance through the intervention of a blue-eyed goddess, who rewarded a temple cat’s love for and devotion to his priest by turning his white coat golden and changing his yellow eyes to blue. His paws remained white as a symbol of his purity. Ever since, the temple cats have borne the goddess’s marks of favor, and it was said that priests who died were reborn into the cats’ bodies.</p><br><p>How the cats really came to be is unknown. Theories include crosses of Siamese with Angoras or Persians, but when or where those original meetups occurred is unknown. They may have taken place in southeast Asia, between various cats who carried the genes for a pointed pattern, long hair and blue eyes, or the breed may have been created in France from cats imported by two Europeans, a Frenchman named Auguste Pavie, and a Major Gordon Russell, who were given a pair of temple cats in 1919 as a reward for aiding the priests. The cats were shipped to France, but the male did not make it there alive. Before he died, however, he had impregnated the female, and her kittens helped to establish the breed in Europe. It was recognized in France in 1925 as the Sacre de Birmanie, from which comes the current breed name, Birman.</p><br><p>The cats were first imported to the United States in 1959 and were recognized by the Cat Fanciers Association in 1967. They are also recognized by the American Cat Fanciers Association, the Canadian Cat Association, the Cat Fanciers Federation and The International Cat Association.</p>","<p>If you like the pointed pattern of the Siamese but not the yowly voice, a Birman might be the cat for you. He is a docile, quiet cat who loves people and will follow them from room to room. Expect the Birman to want to be involved in what you’re doing, and be grateful that he’s not as bossy as the Siamese.</p><br><p>Docile doesn’t mean dumb. The Birman is a smart cat and, of course, curious. He likes to explore his environment and has been known to get trapped underneath floors that are being replaced or to accidentally (maybe on purpose) go for a ride on top of a car. It’s a good idea to always keep tabs on where he is.</p><br><p>He communicates in a soft voice, mainly to remind you that perhaps it’s time for dinner or maybe for a nice cuddle on the sofa. He enjoys being held and will relax in your arms like a furry baby.</p>","<p>Despite the length of the Birman’s coat, it has a silky texture that doesn’t mat easily. Comb it weekly to remove dead hair and distribute skin oils. Birmans shed their winter coat in the spring, so you may want to comb more frequently then to remove loose hair. A warm bath can also help to loosen and remove the shedding coat. To accomplish a Birman bath, wetting the cat with a hand-held shower nozzle is often preferable to immersing him in a tub of water.</p><br><p>Brush the teeth to prevent periodontal disease. Daily dental hygiene is best, but weekly brushing is better than nothing. Trim the nails every couple of weeks. Wipe the corners of the eyes with a soft, damp cloth to remove any discharge. Use a separate area of the cloth for each eye so you don’t run the risk of spreading any infection. Check the ears weekly. If they look dirty, wipe them out with a cotton ball or soft damp cloth moistened with a 50-50 mixture of cider vinegar and warm water. Avoid using cotton swabs, which can damage the interior of the ear.</p><br><p>Keep the Birman’s litter box spotlessly clean. Cats are very particular about bathroom hygiene, and a clean litter box will help to keep the coat clean as well. It’s a good idea to keep a Birman as an indoor-only cat to protect him from diseases spread by other cats, attacks by dogs or coyotes, and the other dangers that face cats who go outdoors, such as being hit by a car. Birmans who go outdoors also run the risk of being stolen by someone who would like to have such a beautiful cat without paying for it.</p>","<p>The friendly, laidback Birman  is a perfect choice for families with children and cat-friendly dogs. He loves the attention he receives from children who treat him politely and with respect, and he doesn’t mind playing dress-up or going for a ride in a baby buggy. He is happy to live with cat-friendly dogs, too, thanks to his amiable disposition. Introduce pets slowly and in controlled circumstances to ensure that they learn to get along together.</p>","<p>Both pedigreed cats and mixed-breed cats have varying incidences of health problems that may be genetic in nature. Problems that may affect the Birman include the following: 1) Congenital hypotrichosis, which causes them to be born with no hair, and thymic aplasia, an immune deficiency that leads to increased risk of infection and death. Fortunately, these conditions are rare. 2) Corneal dermoid, the presence of skin and hair on the surface of the cornea of one or both eyes. It can be corrected surgically. 3) Spongiform degeneration, a progressive degenerative disease of the central nervous system causing signs that include hind-limb weakness and uncoordinated movement.</p>"
9,Bombay,The Bombaay typically weighs between 6 and 11 pounds.,12 to 16 years,/assets/images/bombay1.jpeg,/assets/images/bombay2.jpeg,/assets/images/bombay3.jpeg,"<p>Cat breeders are an experimental lot, creating distinctive new breeds either by building on natural genetic mutations or by crossing breeds to achieve a new look, color or pattern. The Bombay, named for the exotic port city of India, has no connection with the subcontinent but was created from crosses between sable Burmese and black American Shorthairs to resemble a black panther in miniature.</p><br><p>Breeder Nikki Horner of Louisville, Kentucky, is credited with developing the Bombay, starting in the late 1950s. Her goal was a sleek, shiny black cat with a muscular body and friendly temperament. British breeders achieved the same look and personality with crosses of Burmese and black domestic shorthairs. .</p><br><p>The Cat Fanciers Association gave the Bombay full recognition in 1978. Today the breed is recognized by all cat associations. To maintain their body type and coat texture, Bombays may be outcrossed to sable Burmese. The CFA also permits outcrosses to black American Shorthairs, but this is rarely done because of differences in body type.</p>","<p>The lively and affectionate Bombay loves people and is adaptable to many different environments and lifestyles. His calm nature makes him a good apartment dweller, and he is amenable to life with other pets, although he definitely wants to be top cat. .</p><br><p>Expect to find the Bombay hogging the warmest spot in the house. That includes under the covers at bedtime. Most will converse with their people in a distinctive but not loud voice. .</p><br><p>Bombays are often good at playing fetch, and some have learned to walk on leash. This is a smart cat who loves to play and will thrive with a family who is willing to teach him tricks, play games with him and provide him with plenty of interactive toys.</p>","<p>The Bombay’s short, sleek coat is easily cared for with a few strokes of the hand or at most weekly brushing or rubdown with a chamois to remove dead hair, distribute skin oil and polish the coat to its gleaming best. A bath is rarely necessary. .</p><br><p>Brush the teeth to prevent periodontal disease. Daily dental hygiene is best, but weekly brushing is better than nothing. Wipe the corners of the eyes with a soft, damp cloth to remove any discharge. Use a separate area of the cloth for each eye so you don’t run the risk of spreading any infection. Check the ears weekly. If they look dirty, wipe them out with a cotton ball or soft damp cloth moistened with a 50-50 mixture of cider vinegar and warm water. Avoid using cotton swabs, which can damage the interior of the ear. Keep the litter box spotlessly clean. Like all cats, Bombays are very particular about bathroom hygiene. </p><br><p>Plan to spay or neuter your Bombay at 6 to 9 months of age. It is not unheard of for Bombays to reach sexual maturity as early as 5 months of age. It’s a good idea to keep a Bombay as an indoor-only cat to protect him from diseases spread by other cats, attacks by dogs or coyotes, and the other dangers that face cats who go outdoors, such as being hit by a car. Bombays who go outdoors also run the risk of being stolen by someone who would like to have such a beautiful cat without paying for it.</p>","<p>The outgoing Bombay is a perfect choice for families with children and cat-friendly dogs. He loves the attention he receives from children who treat him politely and with respect. He lives peacefully with cats and dogs who respect his authority. Always introduce pets slowly and in controlled circumstances to ensure that they learn to get along together.</p>","<p>Both pedigreed cats and mixed-breed cats have varying incidences of health problems that may be genetic in nature. Bombays are generally healthy, although one of the genetic diseases seen in Burmese has also been seen in Bombays: craniofacial defect.</p><br><p>Sometimes called Burmese head defect, the craniofacial abnormality is occasionally seen in newborn kittens, which may have severely deformed heads. Those kittens are euthanized, so people who are buying Bombay kittens will not encounter the problem, but breeders should research pedigrees carefully to make sure they don’t breed cats who carry the gene for the defect.</p>"
10,British Shorthair,The British Shorthair is a large cat and typically weights 12 to 20 pounds,12 to 17 years,/assets/images/britishShorthair1.jpeg,/assets/images/britishShorthair2.jpeg,/assets/images/britishShorthair3.jpeg,"<p>You may not realize it, but you probably grew up with the British Shorthair. He is the clever feline of Puss in Boots and the grinning Cheshire Cat of Alice in Wonderland. The British Shorthair is native to England. With the rise of cat shows during the Victorian era, cat fanciers began to breed the cats to a particular standard and keep pedigrees for them. At the earliest cat shows, British Shorthairs were the only pedigreed cats exhibited. All others were simply described by coat type or color.</p><br><p>Two world wars devastated the breed, and few British Shorthairs remained after World War II. With the help of other breeds, the Shorthairs, as they are called in Britain, were revitalized. The American Cat Association recognized the British Shorthair in 1967, but the Cat Fanciers Association did not accept it until 1980. Now, all cat associations recognize the breed.</p>","<p>The British Shorthair is mellow and easygoing, making him an excellent family companion. He enjoys affection, but he’s not a me, me, me type of cat. Expect him to follow you around the house during the day, settling nearby wherever you stop. Full of British reserve, the Shorthair has a quiet voice and is an undemanding companion. He doesn’t require a lap, although he loves to sit next to you. Being a big cat, he isn’t fond of being carried around. </p><br><p>This is a cat with a moderate activity level. He’s energetic during kittenhood, but usually starts to settle down by the time he is a year old. More mature British Shorthairs are usually couch potatoes, but adult males occasionally behave like goofballs. When they run through the house, they can sound like a herd of elephants. British Shorthairs are rarely destructive; their manners are those of a proper governess, not a soccer hooligan. They welcome guests confidently.</p>","<p>The British Shorthair’s short, smooth coat is simple to groom with weekly brushing or combing to remove dead hairs. A bath is rarely necessary. Brush the teeth to prevent periodontal disease. Daily dental hygiene is best, but weekly brushing is better than nothing. Trim the nails weekly. Wipe the corners of the eyes with a soft, damp cloth to remove any discharge. Use a separate area of the cloth for each eye so you don’t run the risk of spreading any infection.</p><br><p>Check the ears weekly. If they look dirty, wipe them out with a cotton ball or soft damp cloth moistened with a 50-50 mixture of cider vinegar and warm water. Avoid using cotton swabs, which can damage the interior of the ear. Keep the litter box spotlessly clean. Cats are very particular about bathroom hygiene. It’s a good idea to keep a British Shorthair as an indoor-only cat to protect him from diseases spread by other cats, attacks by dogs or coyotes, and the other dangers that face cats who go outdoors, such as being hit by a car. British Shorthairs who go outdoors also run the risk of being stolen by someone who would like to have such a beautiful cat without paying for it.</p>","<p>This mild-mannered cat is well suited to life with families with children and cat-friendly dogs. He loves the attention he receives from children who treat him politely and with respect and is forgiving of clumsy toddlers. Supervise young children and show them how to pet the cat nicely. Instead of holding or carrying the cat, have them sit on the floor and pet him. Other cats will not disturb his equilibrium. For best results, always introduce any pets, even other cats, slowly and in a controlled setting.</p>","<p>Both pedigreed cats and mixed-breed cats have varying incidences of health problems that may be genetic in nature. Problems that have been seen in the Shorthair are gingivitis and hypertrophic cardiomyopathy, both of which can affect any breed.</p>"
